cups,procedimiento
82101,RESECCION DE CHALAZION VIA ANTERIOR
82102,RESECCION DE CHALAZION VIA POSTERIOR
88001,REPARACION DE HERIDA EN CEJA
88201,SUTURA SUPERFICIAL DE HERIDA UNICA DE PARPADO
88202,SUTURA SUPERFICIAL DE HERIDA MULTIPLE DE PARPADO
161101,EXTRACCION DE CUERPO EXTRANO EN ORBITA
180201,DRENAJE DE COLECCION DE CONDUCTO AUDITIVO EXTERNO
184101,SUTURA DE LACERACION DE PABELLON AURICULAR
230101,EXODONCIA DE DIENTE PERMANENTE UNIRRADICULAR
230102,EXODONCIA DE DIENTE PERMANENTE MULTIRRADICULAR
230103,EXODONCIA DE DIENTES PERMANENTES
230201,EXODONCIA DE DIENTE TEMPORAL UNIRRADICULAR
230202,EXODONCIA DE DIENTE TEMPORAL MULTIRRADICULAR
230203,EXODONCIA DE DIENTES TEMPORALES
231101,EXODONCIA QUIRURGICA UNIRRADICULAR
231201,EXODONCIA QUIRURGICA MULTIRRADICULAR
232101,OBTURACION DENTAL CON AMALGAMA +
232102,OBTURACION DENTAL CON RESINA DE FOTOCURADO
232103,OBTURACION DENTAL CON IONOMERO DE VIDRIO
232201,OBTURACION TEMPORAL POR DIENTE
232401,RECONSTRUCCION DE ANGULO INCISAL
232402,RECONSTRUCCION TERCIO INCISAL
234401,INSERCION - ADAPTACION Y CONTROL DE PROTESIS MUCOSOPORTADA TOTAL MEDIO CASO SUPERIOR O INFERIOR
234402,INSERCION - ADAPTACION Y CONTROL DE PROTESIS MUCOSOPORTADA TOTAL SUPERIOR E INFERIOR
237102,PULPOTOMIA
237103,PULPECTOMIA
237301,TERAPIA DE CONDUCTO RADICULAR EN DIENTE UNIRRADICULAR
237302,TERAPIA DE CONDUCTO RADICULAR EN DIENTE BIRRADICULAR
237304,TERAPIA DE CONDUCTO RADICULAR EN DIENTE TEMPORAL UNIRRADICULAR
240301,"""ALISADO RADICULAR"
243201,SUTURA DE LACERACION DE ENCIA - MENOR DE TRES CENTIMETROS
247401,FERULIZACION RIGIDA (SUPERIOR O INFERIOR)
247402,FERULIZACION SEMIRRIGIDA (SUPERIOR O INFERIOR)
249101,CONTROL DE HEMORRAGIA DENTAL POSQUIRURGICA
274901,REMOCION DE CUERPO EXTRANO EN TEJIDOS BLANDOS DE LA BOCA
275101,SUTURA O REPARACION DE LACERACION (HERIDA) EN LABIOS HASTA DE CINCO CENTIMETROS
275102,SUTURA O REPARACION DE LACERACION (HERIDA) EN LABIOS DE MAS DE CINCO CENTIMETROS
275104,SUTURA DE LACERACION EN LABIOS
275203,SUTURA DE LACERACION DE OTRA PARTE DE LA BOCA
389301,CATETERISMO O CANALIZACION DE VENA
579401,INSERCION DE DISPOSITIVO URINARIO (VESICAL)
579501,REEMPLAZO DE DISPOSITIVO URINARIO (VESICAL)
697101,INSERCION DE DISPOSITIVO INTRAUTERINO ANTICONCEPTIVO [DIU]
721003,PARTO INSTRUMENTADO
732201,PARTO INTERVENIDO CON MANIOBRAS DE VERSION
735301,ASISTENCIA DEL PARTO CON O SIN EPISIORRAFIA O PERINEORRAFIA
735980,OTRA ASISTENCIA MANUAL DEL PARTO ESPONTANEO
750303,EVACUACION UTERINA PARA TERMINACION DEL EMBARAZO POR OTROS METODOS
754101,"""REMOCION MANUAL DE PLACENTA RETENIDA O REVISION UTERINA"
786902,"""EXTRACCION DE CUERPO EXTRANO EN FALANGES (UNO O MAS) DE MANO"
797101,REDUCCION CERRADA DE LUXACION EN HOMBRO
829910,EXTRACCION DE CUERPO EXTRANO EN TEJIDOS BLANDOS DE DEDOS DE LA MANO
858101,SUTURA DE HERIDA DE MAMA
860207,LEISHMANIA PRUEBA [ DE MONTENEGRO ]
861101,DRENAJE DE COLECCION SUPERFICIAL DE PIEL O TEJIDO CELULAR SUBCUTANEO POR INCISION O ASPIRACION
861102,DRENAJE DE COLECCION PROFUNDA EN PIEL O TEJIDO CELULAR SUBCUTANEO POR INCISION O ASPIRACION
861201,EXTRACCION DE CUERPO EXTRANO EN PIEL O TEJIDO CELULAR SUBCUTANEO DE AREA GENERAL POR INCISION
861202,EXTRACCION DE CUERPO EXTRANO EN PIEL O TEJIDO CELULAR SUBCUTANEO DE AREA ESPECIAL POR INCISION
861203,EXTRACCION DE ANTICONCEPTIVOS SUBDERMICOS POR INCISION
861801,INSERCION DE ANTICONCEPTIVOS SUBDERMICOS
862701,ONICECTOMIA
865101,"""SUTURA DE HERIDA UNICA"
865102,"""SUTURA DE HERIDA MULTIPLE"
865201,SUTURA DE HERIDA UNICA DE CARA
865202,SUTURA DE HERIDA UNICA DE CARA SIN COMPROMISO DE LABIOS O PARPADOS
865203,"""SUTURA DE HERIDA UNICA DE PLIEGUES DE FLEXION"
865204,SUTURA DE HERIDA MULTIPLE DE CARA
865205,SUTURA DE HERIDA MULTIPLE DE CARA SIN COMPROMISO DE LABIOS O PARPADOS
865206,"""SUTURA DE HERIDA MULTIPLE DE PLIEGUES DE FLEXION"
865207,SUTURA DE HERIDA PARCIAL DE CUERO CABELLUDO (ESCALPE)
865208,"""SUTURA DE AVULSION EN PABELLON AURICULAR"
865210,SUTURA DE MATRIZ UNGUEAL
869401,RETIRO DE SUTURA EN PIEL O TEJIDO CELULAR SUBCUTANEO
869501,CURACION DE LESION EN PIEL O TEJIDO CELULAR SUBCUTANEO
870001,RADIOGRAFIA DE CRANEO SIMPLE
870003,RADIOGRAFIA DE BASE DE CRANEO
870005,RADIOGRAFIA DE MASTOIDES COMPARATIVAS
870101,RADIOGRAFIA DE CARA (PERFILOGRAMA)
870102,RADIOGRAFIA DE ORBITAS
870105,RADIOGRAFIA DE ARCO CIGOMATICO
870107,RADIOGRAFIA DE HUESOS NASALES
870108,RADIOGRAFIA DE SENOS PARANASALES
870112,RADIOGRAFIA DE MAXILAR SUPERIOR
870113,RADIOGRAFIA DE MAXILAR INFERIOR
870131,RADIOGRAFIA DE ARTICULACION TEMPOROMAXILAR [ATM]
870460,RADIOGRAFIAS INTRAORALES CORONALES
870601,RADIOGRAFIA DE TEJIDOS BLANDOS DE CUELLO
870602,RADIOGRAFIA DE CAVUM FARINGEO
871010,RADIOGRAFIA DE COLUMNA CERVICAL
871019,RADIOGRAFIA DE COLUMNA UNION CERVICO DORSAL
871020,RADIOGRAFIA DE COLUMNA TORACICA
871030,RADIOGRAFIA DE COLUMNA DORSOLUMBAR
871040,RADIOGRAFIA DE COLUMNA LUMBOSACRA
871050,RADIOGRAFIA DE SACRO COCCIX
871060,RADIOGRAFIA DE COLUMNA VERTEBRAL TOTAL
871062,"""RADIOGRAFIA PANORAMICA DE COLUMNA (GONIOMETRIA U ORTOGRAMA) FORMATO 14"""" X 17"""" (NINOS)"""
871091,RADIOGRAFIA DE ARTICULACIONES SACROILIACAS
871111,RADIOGRAFIA DE REJA COSTAL
871112,RADIOGRAFIA DE ESTERNON
871121,"""RADIOGRAFIA DE TORAX (P.A. O A.P. Y LATERAL"
871129,RADIOGRAFIA DE ARTICULACIONES ESTERNOCLAVICULARES
872002,RADIOGRAFIA DE ABDOMEN SIMPLE
873004,RADIOGRAFIA PARA DETECTAR EDAD OSEA [CARPOGRAMA]
873111,RADIOGRAFIA DE OMOPLATO
873112,RADIOGRAFIA DE CLAVICULA
873121,RADIOGRAFIA DE HUMERO
873122,RADIOGRAFIA DE ANTEBRAZO
873123,RADIOGRAFIAS COMPARATIVAS DE EXTREMIDADES SUPERIORES
873202,RADIOGRAFIA DE ARTICULACIONES ACROMIO CLAVICULARES COMPARATIVAS
873204,RADIOGRAFIA DE HOMBRO
873205,RADIOGRAFIA DE CODO
873206,RADIOGRAFIA DE PUNO O MUNECA
873210,RADIOGRAFIA DE MANO
873303,RADIOGRAFIA COMPARATIVA DE PIES CON APOYO (AP Y LATERAL)
873306,"""RADIOGRAFIA PANORAMICA DE MIEMBROS INFERIORES (GONIOMETRIA U ORTOGRAMA)"
873312,"""RADIOGRAFIA DE FEMUR (AP"
873313,"""RADIOGRAFIA DE PIERNA (AP"
873314,RADIOGRAFIA DE ANTEVERSION TIBIAL
873333,"""RADIOGRAFIA DE PIE (AP"
873335,RADIOGRAFIA DE CALCANEO (AXIAL Y LATERAL)
873340,"""RADIOGRAFIA DE MIEMBRO INFERIOR (AP"
873411,"""RADIOGRAFIA DE CADERA O ARTICULACION COXO-FEMORAL (AP"
873412,RADIOGRAFIA DE CADERA COMPARATIVA
873420,"""RADIOGRAFIA DE RODILLA (AP"
873422,RADIOGRAFIA DE RODILLAS COMPARATIVAS POSICION VERTICAL (UNICAMENTE VISTA ANTEROPOSTERIOR)
873431,"""RADIOGRAFIA DE TOBILLO (AP"
873443,RADIOGRAFIAS COMPARATIVAS DE EXTREMIDADES INFERIORES
890101,ATENCION ( VISITA ) DOMICILIARIA - POR MEDICINA GENERAL
890103,"""ATENCION (VISITA) DOMICILIARIA"
890105,ATENCION ( VISITA ) DOMICILIARIA - POR ENFERMERIA. -- INCY : PROCEDIMIENTOS REALIZADOS POR ENFERMERA PROFESIONAL O AUXILIAR DE ENFERMERIA BAJO SU ESTRICTA SUPERVISION
890108,ATENCION ( VISITA ) DOMICILIARIA - POR PSICOLOGIA
890111,"""ATENCION (VISITA) DOMICILIARIA"
890112,"""ATENCION (VISITA) DOMICILIARIA"
890114,ATENCION ( VISITA ) DOMICILIARIA - POR PROMOTOR DE LA SALUD
890201,CONSULTA DE PRIMERA VEZ POR MEDICINA GENERAL
890203,CONSULTA DE PRIMERA VEZ POR ODONTOLOGIA GENERAL
890205,CONSULTA DE PRIMERA VEZ POR ENFERMERIA
890206,CONSULTA DE PRIMERA VEZ POR NUTRICION Y DIETETICA
890208,CONSULTA DE PRIMERA VEZ POR PSICOLOGIA
890209,CONSULTA DE PRIMERA VEZ POR TRABAJO SOCIAL
890211,CONSULTA DE PRIMERA VEZ POR FISIOTERAPIA
890301,CONSULTA DE CONTROL O DE SEGUIMIENTO POR MEDICINA GENERAL
890303,CONSULTA DE CONTROL O DE SEGUIMIENTO POR ODONTOLOGIA GENERAL
890305,CONSULTA DE CONTROL O DE SEGUIMIENTO POR ENFERMERIA
890306,CONSULTA DE CONTROL O DE SEGUIMIENTO POR NUTRICION Y DIETETICA
890308,CONSULTA DE CONTROL O DE SEGUIMIENTO POR PSICOLOGIA
890311,CONSULTA DE CONTROL O DE SEGUIMIENTO POR FISIOTERAPIA
890403,INTERCONSULTA POR ODONTOLOGIA GENERAL
890405,INTERCONSULTA POR ENFERMERIA
890406,INTERCONSULTA POR NUTRICION Y DIETETICA
890408,INTERCONSULTA POR PSICOLOGIA
890409,INTERCONSULTA POR TRABAJO SOCIAL
890411,INTERCONSULTA POR FISIOTERAPIA
890412,INTERCONSULTA POR TERAPIA RESPIRATORIA
890601,CUIDADO (MANEJO) INTRAHOSPITALARIO POR MEDICINA GENERAL ATENCION DIARIA
890609,ASISTENCIA INTRAHOSPITALARIA POR TRABAJO SOCIAL
890701,CONSULTA DE URGENCIAS POR MEDICINA GENERAL
890703,CONSULTA DE URGENCIAS POR ODONTOLOGIA GENERAL
890704,CONSULTA DE URGENCIAS POR ODONTOLOGIA ESPECIALIZADA
892901,TOMA NO QUIRURGICA DE MUESTRA O TEJIDO CERVICOVAGINAL PARA ESTUDIO CITOLOGICO
892904,TECNICAS DE INSPECCION VISUAL CON ACIDO ACETICO Y LUGOL
893805,ESPIROMETRIA O CURVA DE FLUJO VOLUMEN PRE Y POST BRONCODILATADORES
893812,REGISTRO DE OXIMETRIA CUTANEA
895004,MONITOREO AMBULATORIO DE PRESION ARTERIAL SISTEMICA
895101,ELECTROCARDIOGRAMA DE RITMO O DE SUPERFICIE
896101,MONITOREO DE PRESION ARTERIAL SISTEMICA (TELEMETRIA)
897011,MONITORIA FETAL ANTEPARTO
897012,MONITORIA FETAL INTRAPARTO
898003,ESTUDIO ANATOMOPATOLOGICO BASICO EN CITOLOGIA POR ASPIRACION CON AGUJA FINA [ACAF] DE CUALQUIER TEJIDO U ORGANO
898015,ESTUDIO ANATOMOPATOLOGICO BASICO EN CITOLOGIA CERVICOVAGINAL MANUAL
901001,ANTIBIOGRAMA (DISCO)
901002,ERITROSEDIMENTACION [ VELOCIDAD SEDIMENTACION GLOBULAR - VSG ] MANUAL
901003,EXTENDIDO DE SANGRE PERIFERICA ESTUDIO DE MORFOLOGIA
901101,BACILOSCOPIA COLORACION ACIDO ALCOHOL-RESISTENTE [ZIEHL-NEELSEN]
901102,COLORACION ACIDO ALCOHOL RESISTENTE MODIFICADA Y LECTURA. -- INCY : ISOSPORA BELLI - CRYPTOSPORIDIUM - ENTRE OTROS
901104,COLORACION AZUL DE METILENO Y LECTURA PARA CUALQUIER MUESTRA
901106,COLORACION GIEMSA Y LECTURA
901107,COLORACION GRAM Y LECTURA PARA CUALQUIER MUESTRA
901111,BACILOSCOPIA COLORACION ACIDO ALCOHOL RESISTENTE [ZIELH-NEELSEN] LECTURA SERIADA TRES MUESTRAS
901206,HEMOPARASITOS EXTENDIDO DE SANGRE PERIFERICA
901210,CULTIVO ESPECIAL PARA OTROS MICROORGANISMOS EN CUALQUIER MUESTRA
901221,PRUEBA DE TORNIQUETE [ FRAGILIDAD CAPILAR ]
901222,RECUENTO DE PLAQUETAS AUTOMATIZADO
901230,MYCOBACTERIUM TUBERCULOSIS CULTIVO
901232,RECUENTO DE PLAQUETAS MANUAL
901235,UROCULTIVO (ANTIBIOGRAMA DE DISCO)
901236,UROCULTIVO (ANTIBIOGRAMA CONCENTRACION MINIMA INHIBITORIA AUTOMATIZADO)
901237,UROCULTIVO (ANTIBIOGRAMA CONCENTRACION MINIMA INHIBITORIA MANUAL)
901304,EXAMEN DIRECTO FRESCO DE CUALQUIER MUESTRA
901305,EXAMEN DIRECTO PARA HONGOS (KOH)
901321,STREPTOCOCCUS BETA HEMOLITICO GRUPO A (PRUEBA DIRECTA)
901325,EXAMEN DIRECTO DE CUALQUIER MUESTRA
901326,LEISHMANIA EXAMEN DIRECTO
902010,ACIDO URICO EN SUERO U OTROS FLUIDOS
902011,ACIDO URICO EN ORINA DE 24 HORAS
902041,ALBUMINA EN SUERO U OTROS FLUIDOS
902045,TIEMPO DE PROTROMBINA [TP]
902049,TIEMPO DE TROMBOPLASTINA PARCIAL [TTP]
902204,ERITROSEDIMENTACION [VELOCIDAD SEDIMENTACION GLOBULAR - VSG] MANUAL
902206,EXTENDIDO DE SANGRE PERIFERICA ESTUDIO DE MORFOLOGIA
902207,HEMOGRAMA I (HEMOGLOBINA HEMATOCRITO Y LEUCOGRAMA) MANUAL
902208,HEMOGRAMA II (HEMOGLOBINA HEMATOCRITO RECUENTO DE ERITROCITOS INDICES ERITROCITARIOS LEUCOGRAMA RECUENTO DE PLAQUETAS E INDICES PLAQUETARIOS) SEMIAUTOMATIZADO
902209,HEMOGRAMA III (HEMOGLOBINA HEMATOCRITO RECUENTO DE ERITROCITOS INDICES ERITROCITARIOS LEUCOGRAMA RECUENTO DE PLAQUETAS INDICES PLAQUETARIOS Y MORFOLOGIA ELECTRONICA) AUTOMATIZADO
902210,HEMOGRAMA IV [HEMOGLOBINA. HEMATOCRITO. RECUENTO DE ERITROCITOS. INDICES ERITROCITARIOS. LEUCOGRAMA. RECUENTO DE PLAQUETAS. INDICES PLAQUETARIOS Y MORFOLOGIA ELECTRONICA E HISTOGRAMA] METODO AUTOMATICO+
902211,HEMATOCRITO
902213,HEMOGLOBINA
902214,HEMOPARASITOS EXTENDIDO DE GOTA GRUESA
902215,HEMOPARASITOS. EXTENDIDO DE SANGRE PERIFERICA *+
902216,LEUCOGRAMA (RECUENTO TOTAL Y DIFERENCIAL)
902217,PRUEBA DE TORNIQUETE [ FRAGILIDAD CAPILAR ]
902220,RECUENTO DE PLAQUETAS AUTOMATIZADO
902221,RECUENTO DE PLAQUETAS MANUAL
902223,RECUENTO DE RETICULOCITOS METODO MANUAL
902224,GLUCOSA CURVA DE TOLERANCIA. -- EXCY : 90. 3. 8. 84 - 90. 3. 8. 85 - 90. 3. 8. 86 - 90. 3. 8. 87 - 90. 3. 8. 88 - 90. 3. 8. 89 - 90. 3. 8. 90 - 90. 3. 8. 91 - 90. 3. 8. 92 - 90. 3. 8. 93 Y 90. 3. 8. 94
903026,MICROALBUMINURIA AUTOMATIZADA EN ORINA PARCIAL
903027,MICROALBUMINURIA AUTOMATIZADA EN ORINA DE 24 HORAS
903028,LIPASA
903426,HEMOGLOBINA GLICOSILADA AUTOMATIZADA
903427,HEMOGLOBINA GLICOSILADA MANUAL O SEMIAUTOMATIZADA
903801,ACIDO URICO EN SUERO U OTROS FLUIDOS
903802,ACIDO URICO EN ORINA DE 24 HORAS
903803,ALBUMINA EN SUERO U OTROS FLUIDOS
903804,TRANSAMINASA GLUTAMICO - PIRUVICA [ ALANINO AMINO TRANSFERASA ]
903805,AMILASA EN SUERO U OTROS FLUIDOS
903809,BILIRRUBINAS TOTAL Y DIRECTA
903810,CALCIO SEMIAUTOMATIZADO
903815,COLESTEROL DE ALTA DENSIDAD
903816,COLESTEROL DE BAJA DENSIDAD SEMIAUTOMATIZADO
903817,COLESTEROL DE BAJA DENSIDAD [LDL] AUTOMATIZADO
903818,COLESTEROL TOTAL
903822,CREATINA
903823,CREATININA DEPURACION
903824,CREATININA EN ORINA DE 24 HORAS
903826,CUERPOS CETONICOS O CETONAS EN ORINA
903828,DESHIDROGENASA LACTICA
903830,TOXOPLASMA GONDII ANTICUERPOS IG G AUTOMATIZADO
903833,FOSFATASA ALCALINA
903840,GLUCOSA EN ORINA
903841,GLUCOSA EN SUERO U OTRO FLUIDO DIFERENTE A ORINA
903842,GLUCOSA PRE Y POST CARGA DE GLUCOSA
903843,GLUCOSA PRE Y POST PRANDIAL
903844,GLUCOSA CURVA DE TOLERANCIA
903845,GLUCOSA TEST O’ SULLIVAN
903847,LIPASA
903856,NITROGENO UREICO
903857,NITROGENO UREICO [BUN] EN ORINA DE 24 H +
903859,POTASIO EN SUERO U OTROS FLUIDOS
903862,PROTEINAS EN ORINA DE 24 HORAS
903863,PROTEINAS TOTALES EN SUERO Y OTROS FLUIDOS
903864,SODIO EN SUERO U OTROS FLUIDOS
903866,TRANSAMINASA GLUTAMICO-PIRUVICA [ALANINO AMINO TRANSFERASA]
903867,TRANSAMINASA GLUTAMICO OXALACETICA [ASPARTATO AMINO TRANSFERASA]
903868,TRIGLICERIDOS
903869,UREA EN SANGRE U OTROS FLUIDOS
903876,CREATININA EN ORINA PARCIAL
903883,GLUCOSA SEMIAUTOMATIZADA [GLUCOMETRIA]
903895,CREATININA EN SUERO U OTROS FLUIDOS
904105,HORMONA FOLICULO ESTIMULANTE
904108,PROLACTINA
904508,GONADOTROPINA CORIONICA SUBUNIDAD BETA CUALITATIVA PRUEBA DE EMBARAZO EN ORINA O SUERO
904902,HORMONA ESTIMULANTE DEL TIROIDES
904903,HORMONA ESTIMULANTE DEL TIROIDES [TSH] NEONATAL
904921,TIROXINA LIBRE
904925,TRIYODOTIRONINA TOTAL
906039,TREPONEMA PALLIDUM ANTICUERPOS (PRUEBA TREPONEMICA) MANUAL O SEMIAUTOMATIZADA O AUTOMATIZADA
906127,TOXOPLASMA GONDII ANTICUERPOS IG G AUTOMATIZADO
906129,TOXOPLASMA GONDII ANTICUERPOS IG M AUTOMATIZADO
906205,CITOMEGALOVIRUS ANTICUERPOS IG G SEMIAUTOMATIZADO O AUTOMATIZADO
906206,CITOMEGALOVIRUS ANTICUERPOS IG M SEMIAUTOMATIZADO O AUTOMATIZADO
906207,DENGUE ANTICUERPOS IG G
906208,DENGUE ANTICUERPOS IG M
906212,HEPATITIS B. ANTIGENO E [AG HBE]
906214,HERPES SIMPLEX I Y II. ANTIGENOS
906218,HEPATITIS A ANTICUERPOS IG M SEMIAUTOMATIZADO O AUTOMATIZADO
906220,COOMBS DIRECTO FRACCIONADO MONOESPECIFICO ( INMUNOGLOBULINAS Y FRACCIONES DEL COMPLEMENTO ) EN TUBO
906221,COOMBS DIRECTO CUALITATIVO POR MICROTECNICA
906222,COOMBS DIRECTO CUALITATIVO EN TUBO
906223,HEPATITIS B ANTICUERPOS S [ANTI-HBS] SEMIAUTOMATIZADO O AUTOMATIZADO
906241,RUBEOLA ANTICUERPOS IG G AUTOMATIZADO
906242,RUBEOLA ANTICUERPOS IG G SEMIAUTOMATIZADO
906243,RUBEOLA ANTICUERPOS IG M AUTOMATIZADO
906247,VARICELA ZOSTER ANTICUERPOS IG G SEMIAUTOMATIZADO O AUTOMATIZADO
906249,VIRUS DE INMUNODEFICIENCIA HUMANA 1 Y 2 ANTICUERPOS
906250,VIRUS DE INMUNODEFICIENCIA HUMANA PRUEBA CONFIRMATORIA
906270,HEMOCLASIFICACION SISTEMA ABO DIRECTA [ HEMOCLASIFICACION GLOBULAR ] POR MICROTECNICA
906271,HEMOCLASIFICACION SISTEMA ABO DIRECTA [ HEMOCLASIFICACION GLOBULAR ] EN TUBO
906304,HEMOCLASIFICACION SISTEMA ABO INVERSA [ HEMOCLASIFICACION SERICA ] POR MICROTECNICA
906317,HEPATITIS B ANTIGENO DE SUPERFICIE [AG HBS]
906318,TERAPIA RESPIRATORIA INTEGRAL. -- INCY : PERCUSION - VIBRACION - DRENAJE POSTURAL - SUCCION - MICRONEBULIZACION - ACELERADOR DE FLUJO - TOS ASISTIDA O EJERCICIOS RESPIRATORIOS
906340,TERAPIA FISICA INTEGRAL. -- INCY : ACTIVIDADES PROPIAS A EJECUTAR EN LOS COMPONENTES SENSORIOMOTORES DEL DESEMPEAO - EJERCICIOS TERAPEUTICOS - ESTIMULACION - MECANOTERAPIA - MEDIOS FISICOS ( HIDROTERAPIA - CRIOTERAPIA - CALOR HUMEDO ) - ELECTROTERAPIA ( B
906610,ANTIGENO ESPECIFICO DE PROSTATA SEMIAUTOMATIZADO O AUTOMATIZADO
906911,FACTOR REUMATOIDEO MANUAL
906914,PROTEINA C REACTIVA MANUAL O SEMIAUTOMATIZADO
906915,PRUEBA NO TREPONEMICA MANUAL
907001,AZUCARES REDUCTORES EN HECES
907002,COPROLOGICO
907003,COPROLOGICO POR CONCENTRACION +
907004,COPROSCOPICO
907005,FROTIS RECTAL [IDENTIFICACION DE TROFOZOITOS] +
907008,SANGRE OCULTA EN MATERIA FECAL [GUAYACO O EQUIVALENTE] +
907009,SANGRE OCULTA EN MATERIA FECAL (DETERMINACION DE HEMOGLOBINA HUMANA ESPECIFICA)
907106,UROANALISIS
907107,RADIOGRAFIA DE PIE ( AP - LATERAL Y OBLICUA )
907202,MOCO CERVICAL ANALISIS (TEST DE HELECHO)
908856,RADIOGRAFIA DE CADERA O ARTICULACION COXO - FEMORAL ( AP - LATERAL )
911007,RADIOGRAFIA DE RODILLA ( AP - LATERAL )
911008,TOMA NO QUIRURGICA DE MUESTRA O TEJIDO CERVICOVAGINAL PARA ESTUDIO CITOLOGICO
911009,TRANSPORTE TERRESTRE DOMICILIARIO DE MEDICAMENTOS - SIMPLE - ZONA URBANA
911010,TRANSPORTE TERRESTRE DOMICILIARIO DE MEDICAMENTOS - SIMPLE - ZONA RURAL
911015,HEMOCLASIFICACION SISTEMA RH [ANTIGENO RH D] POR MICROTECNICA
911016,HEMOCLASIFICACION SISTEMA RH [ANTIGENO RH D] EN TUBO
911017,HEMOCLASIFICACION SISTEMA ABO DIRECTA [HEMOCLASIFICACION GLOBULAR] POR MICROTECNICA
911018,HEMOCLASIFICACION SISTEMA ABO DIRECTA [HEMOCLASIFICACION GLOBULAR] EN TUBO
911019,HEMOCLASIFICACION SISTEMA ABO INVERSA [HEMOCLASIFICACION SERICA] POR MICROTECNICA
911020,HEMOCLASIFICACION SISTEMA ABO INVERSA [HEMOCLASIFICACION SERICA] EN TUBO
931001,TERAPIA FISICA INTEGRAL
933701,ENTRENAMIENTO PRE - PERI Y POST PARTO
935001,INMOVILIZACION - PRESION Y CUIDADO DE HERIDA
935101,APLICACION DE VENDAJE ENYESADO
935301,APLICACION O CAMBIO DE YESO PARA INMOVILIZACION EN MIEMBRO SUPERIOR (EXCEPTO MANO)
935302,APLICACION O CAMBIO DE YESO PARA INMOVILIZACION EN MANO
935303,APLICACION O CAMBIO DE YESO O ARNES TORACOLUMBOSACRO
935304,"""APLICACION O CAMBIO DE YESO PARA INMOVILIZACION EN MIEMBRO INFERIOR (MUSLO"
935305,APLICACION O CAMBIO DE YESO EN PIE
935306,"""APLICACION O CAMBIO DE YESO"
935401,APLICACION DE FERULA
935701,APLICACION DE OTRO VENDAJE (NO COMPRESIVO) EN HERIDA
935901,APLICACION DE VENDAJE DE VELPEAU
936801,INMOVILIZACION O MANIPULACION ARTICULAR INESPECIFICA
939401,MEDICACION RESPIRATORIA ADMINISTRADA MEDIANTE NEBULIZACION (AEROSOLTERAPIA)
939402,NEBULIZACION
939403,TERAPIA RESPIRATORIA INTEGRAL
943102,PSICOTERAPIA INDIVIDUAL POR PSICOLOGIA
944002,PSICOTERAPIA DE PAREJA POR PSICOLOGIA
944102,PSICOTERAPIA FAMILIAR POR PSICOLOGIA
944202,PSICOTERAPIA DE GRUPO POR PSICOLOGIA
950601,MEDICION DE AGUDEZA VISUAL
960201,INSERCION DE VIA AEREA OROFARINGEA
960701,INSERCION DE OTRO TUBO O SONDA NASO-GASTRICA ( INTUBACION PARA DECOMPRESION )
961401,TAPONAMIENTO VAGINAL
961601,INSERCION DE DISPOSITIVO EN URETRA
963101,CONSULTA DE CONTROL O DE SEGUIMIENTO POR ENFERMERIA
963301,LAVADO GASTRICO DE LIMPIEZA
963801,EXTRACCION DIGITAL O MANUAL DE HECES IMPACTADAS
963901,IRRIGACION O ENEMA TRANSANAL
965101,IRRIGACION Y LAVADO DEL OJO
965201,LAVADO E IRRIGACION DE OIDOS
965301,IRRIGACION O CURACION DE CONDUCTOS NASALES
965901,"""LAVADO"
970101,SUSTITUCION DE TUBO (SONDA) NASOGASTRICO O DE ESOFAGOSTOMIA
971101,SUSTITUCION DE ESCAYOLA O FERULA EN MIEMBRO SUPERIOR
971201,SUSTITUCION DE ESCAYOLA O FERULA EN MIEMBRO INFERIOR
971401,SUSTITUCION DE OTRO DISPOSITIVO PARA INMOVILIZACION MUSCULOESQUELETICA
971601,SUSTITUCION DE TAPON O DRENAJE DE HERIDA
972101,SUSTITUCION DE TAPON NASAL
972201,SUSTITUCION DE TAPON DENTAL
973201,EXTRACCION DE TAPON NASAL
973801,RETIRO DE SUTURAS DE CABEZA Y CUELLO (RETIRO DE PUNTOS)
974301,RETIRO DE SUTURAS DE TORAX ( RETIRO DE PUNTOS )
976501,EXTRACCION DE DISPOSITIVO URETRAL
977101,EXTRACCION DE DISPOSITIVO ANTICONCEPTIVO INTRAUTERINO (DIU)
977501,EXTRACCION DE TAPON ( MECHA ) VAGINAL O VULVAR
978301,EXTRACCION DE SUTURAS DE PARED ABDOMINAL
981101,EXTRACCION SIN INCISION DE CUERPO EXTRANO DE CONDUCTO AUDITIVO EXTERNO
981201,EXTRACCION DE CUERPO EXTRANO DE LA NARIZ SIN INCISION VIA TRANSNASAL
981701,EXTRACCION SIN INCISION DE CUERPO EXTRANO INTRALUMINAL DE LA VAGINA
982101,EXTRACCION DE CUERPO EXTRANO SUPERFICIAL DE LA CONJUNTIVA
982102,EXTRACCION DE CUERPO EXTRANO SUPERFICIAL EN CORNEA O ESCLEROTICA
982201,EXTRACCION SIN INCISION DE CUERPO EXTRANO NO INTRALUMINAL EN CUELLO O CABEZA
982501,EXTRACCION SIN INCISION DE CUERPO EXTRANO NO INTRALUMINAL EN OTRO SITIO SALVO EN VULVA - PENE O ESCROTO
982601,EXTRACCION SIN INCISION DE CUERPO EXTRANO EN MANO
982701,EXTRACCION SIN INCISION DE CUERPO EXTRANO EN BRAZO Y ANTEBRAZO
982801,EXTRACCION SIN INCISION DE CUERPO EXTRANO EN PIE
982901,EXTRACCION SIN INCISION DE CUERPO EXTRANO EN MIEMBRO INFERIOR SALVO PIE
990101,"""EDUCACION GRUPAL EN SALUD"
990103,"""EDUCACION GRUPAL EN SALUD"
990104,"""EDUCACION GRUPAL EN SALUD"
990105,"""EDUCACION GRUPAL EN SALUD"
990106,"""EDUCACION GRUPAL EN SALUD"
990107,"""EDUCACION GRUPAL EN SALUD"
990108,"""EDUCACION GRUPAL EN SALUD"
990111,"""EDUCACION GRUPAL EN SALUD"
990112,"""EDUCACION GRUPAL EN SALUD"
990113,"""EDUCACION GRUPAL EN SALUD"
990201,"""EDUCACION INDIVIDUAL EN SALUD"
990203,"""EDUCACION INDIVIDUAL EN SALUD"
990204,"""EDUCACION INDIVIDUAL EN SALUD"
990205,"""EDUCACION INDIVIDUAL EN SALUD"
990206,"""EDUCACION INDIVIDUAL EN SALUD"
990207,"""EDUCACION INDIVIDUAL EN SALUD"
990211,CONSEJERIA EN VIH
990212,"""EDUCACION INDIVIDUAL EN SALUD"
991402,APLICACION INMUNOGLOBULINA ANTIRRABICA
991403,APLICACION INMUNOGLOBULINA ANTITETANICA
991601,INYECCION DE ANTIDOTO
991801,INFUSION O ADMINISTRACION DE SOLUCIONES DE LIQUIDOS Y ELECTROLITOS
992102,INYECCION O INFUSION DE ANTIBIOTICO
992201,INYECCION O INFUSION DE SUSTANCIA HORMONAL
992990,INYECCION O INFUSION DE OTRA SUSTANCIA TERAPEUTICA O PROFILACTICA
993102,VACUNACION CONTRA TUBERCULOSIS [BCG]
993103,VACUNACION CONTRA MENINGOCOCO (AC O BC)
993104,VACUNACION CONTRA HAEMOPHILUS INFLUENZA TIPO B
993105,ADMINISTRACION DE TOXOIDE DIFTERICO
993106,VACUNACION CONTRA NEUMOCOCO
993107,ADMINISTRACION DE TOXOIDE DE TETANOS
993120,VACUNACION COMBINADA CONTRA TETANOS Y DIFTERIA [TD]
993122,"""VACUNACION COMBINADA CONTRA DIFTERIA"
993130,"""VACUNACION COMBINADA CONTRA HAEMOPHILUS INFLUENZA TIPO B"
993501,VACUNACION CONTRA POLIOMIELITIS (VOP O IVP)
993502,VACUNACION CONTRA HEPATITIS A
993503,VACUNACION CONTRA HEPATITIS B
993504,VACUNACION CONTRA FIEBRE AMARILLA
993505,VACUNACION CONTRA RABIA
993506,VACUNACION CONTRA SARAMPION
993507,VACUNACION CONTRA PAROTIDITIS
993508,VACUNACION CONTRA RUBEOLA
993509,VACUNACION CONTRA VARICELA
993510,VACUNACION CONTRA INFLUENZA
993512,VACUNACION CONTRA ROTAVIRUS
993513,VACUNACION CONTRA VIRUS PAPILOMA HUMANO [VPH]
993520,VACUNACION COMBINADA CONTRA SARAMPION Y RUBEOLA [SR] (DOBLE VIRAL)
993522,"""VACUNACION COMBINADA CONTRA SARAMPION"
994101,ADMINISTRACION DE ANTITOXINA TETANICA
994301,ADMINISTRACION DE ANTITOXINA DIFTERICA
995201,OTRA VACUNACION DEL PROGRAMA AMPLIADO DE INMUNIZACIONES
995202,ADMINISTRACION VACUNA SARS COV 2 [ COVID-19 ]
997002,CONTROL DE PLACA DENTAL
997103,TOPICACION DE FLUOR EN GEL
997105,APLICACION DE RESINA PREVENTIVA
997106,TOPICACION DE FLUOR EN BARNIZ
997107,APLICACION DE SELLANTES
997301,DETARTRAJE SUPRAGINGIVAL
1906317,HEPATITIS B. ANTIGENO DE SUPERFICIE (PRUEBA RAPIDA)
9062081,DENGUE - ANTICUERPOS [ IG G - IG M ] - PRUEBA RAPIDA
9062082,DENGUE DUO (DENGUE NS1 AG + IGG/IGM) PRUEBA RAPIDA
082101,RESECCION DE CHALAZION VIA ANTERIOR
082102,RESECCION DE CHALAZION VIA POSTERIOR
088201,SUTURA SUPERFICIAL DE HERIDA UNICA DE PARPADO
088202,SUTURA SUPERFICIAL DE HERIDA MULTIPLE DE PARPADO
129B01,INTERNACION ADULTOS COMPLEJIDAD BAJA HABITACION INDIVIDUAL (INCLUYE AISLAMIENTO)
129B02,INTERNACION ADULTOS COMPLEJIDAD BAJA HABITACION MULTIPLE
5DS002,DERECHOS DE SALA DE CURACIONES O PROCEDIMIENTOS
5DS003,DERECHOS DE SALA DE PEQUENA CIRUGIA (SUTURAS)
5DS004,DERECHOS DE SALA DE YESOS
5DSB01,DERECHOS DE SALA DE OBSERVACION EN URGENCIAS COMPLEJIDAD BAJA
601T01,TRASLADO ASISTENCIAL BASICO TERRESTRE PRIMARIO
601T02,TRASLADO ASISTENCIAL BASICO TERRESTRE SECUNDARIO
906249PR,COLORACION GRAM Y LECTURA PARA CUALQUIER MUESTRA. -- INCY : SECRECION VAGINAL - URETRAL O RECTAL
90DS02,DERECHOS DE SALA DE PARTO COMPLEJIDAD BAJA
P0000002,CONSEJERIA EN VIH
P0000003,DEMANDA INDUCIDA CANALIZADOS ALTERACIONES DE LA EMBARAZADA
P0000008,DEMANDA INDUCIDA CANALIZADOS CANCER DE SENO
P0000009,DEMANDA INDUCIDA CANALIZADOS CRECIMIENTO Y DESARROLLO
P0000010,DEMANDA INDUCIDA CANALIZADOS PLANIFICACION FAMILIAR
P0000011,DEMANDA INDUCIDA CANALIZADOS SALUD BUCAL
P0000012,DEMANDA INDUCIDA CANALIZADOS TOMA DE CITOLOGIA
P0000013,DEMANDA INDUCIDA CANALIZADOS VACUNACION PAI
P0000014,DEMANDA INDUCIDA CANALIZADOS VALORACION DEL JOVEN
P0000081,TOMA DE MUESTRA VIH 1 Y 2 - ANTICUERPOS
P0000221,CONSULTA PRIORITARIA - MEDICINA GENERAL
P0000288,TOMA DE MUESTRA - HEPATITIS B - ANTIGENO DE SUPERFICIE [AG HBS]
P0000775,VIH - PRUEBA RAPIDA
P0000776,HEPATITIS B - PRUEBA RAPIDA
P0000777,DENGUE - ANTICUERPOS [ IG G - IG M ] - PRUEBA RAPIDA
P0000778,SALA EDA ( ENFERMEDAD DIARREICA AGUDA )
P0000779,SALA IRA ( INFECCION RESPIRATORIA AGUDA )
P0001244,TOMA DE MUESTRA CULTIVO ESPECIALES PARA OTROS MICROORGANISMOS
P0001245,TOMA DE MUESTRA GONADOTROPINA CORIONICA - SUBUNIDAD BETA CUALITATIVA - [BHCG] PRUEBA DE EMBARAZO EN ORINA O SUERO
P0001246,TOMA DE MUESTRA QUIMICA SANGUINEA
P0001619,CONSULTA DE PRIMERA VEZ - MEDICINA GENERAL POR TELECONSULTA
P0001620,CONSULTA DE CONTROL O DE SEGUIMIENTO - MEDICINA GENERAL POR TELECONSULTA
P0001621,SUTURA DE HERIDA UNICA - EN AREA GENERAL
P0001852,ATENCION ( VISITA ) DOMICILIARIA - POR MEDICINA GENERAL - EXPEDICION CERTIFICADO DEFUNCION
P0001853,TRANSPORTE DE CUALQUIER MUESTRA ( EVENTOS INTERES EN SALUD PUBLICA )
T0000709,CONSULTA DE CONTROL O DE SEGUIMIENTO POR ENFERMERIA
T0000710,EXTRACCION DE DISPOSITIVO ANTICONCEPTIVO INTRAUTERINO ( DIU )
T0000711,INSERCION DE DISPOSITIVO INTRAUTERINO ANTICONCEPTIVO [ DIU ]
T0000712,EXTRACCION DE ANTICONCEPTIVOS SUBDERMICOS POR INCISION
T0001388,ATENCION ( VISITA ) DOMICILIARIA - POR MEDICINA GENERAL
T0001630,TRANSPORTE TERRESTRE DOMICILIARIO DE MEDICAMENTOS - SIMPLE - ZONA URBANA
T0001634,TRANSPORTE TERRESTRE DOMICILIARIO DE MEDICAMENTOS - SIMPLE - ZONA RURAL
10000,TRASLADO TERRESTRE BASICO DE PACIENTES - SECUNDARIO - A MOCOA (MEDICO).
